4649-4/05;Comércio atacadista de artigos de tapeçaria; persianas e cortinas
4649-4/06;Comércio atacadista de lustres, luminárias e abajures
4649-4/07;Comércio atacadista de filmes, CDs, DVDs, fitas e discos
4649-4/08;Comércio atacadista de produtos de higiene, limpeza e conservação domiciliar
4649-4/09;Comércio atacadista de produtos de higiene, limpeza e conservação domiciliar, com atividade de fracionamento e acondicionamento associada
4649-4/10;Comércio atacadista de jóias, relógios e bijuterias, inclusive pedras preciosas e semipreciosas lapidadas
4649-4/99;Comércio atacadista de outros equipamentos e artigos de uso pessoal e doméstico não especificados anteriormente
4651-6/01;Comércio atacadista de equipamentos de informática
4651-6/02;Comércio atacadista de suprimentos para informática
4652-4/00;Comércio atacadista de componentes eletrônicos e equipamentos de telefonia e comunicação
4661-3/00;Comércio atacadista de máquinas, aparelhos e equipamentos para uso agropecuário; partes e peças
4662-1/00;Comércio atacadista de máquinas, equipamentos para terraplenagem, mineração e construção; partes e peças
4663-0/00;Comércio atacadista de máquinas e equipamentos para uso industrial; partes e peças
4664-8/00;Comércio atacadista de máquinas, aparelhos e equipamentos para uso odonto-médico-hospitalar; partes e peças
4665-6/00;Comércio atacadista de máquinas e equipamentos para uso comercial; partes e peças
4669-9/01;Comércio atacadista de bombas e compressores; partes e peças
4669-9/99;Comércio atacadista de outras máquinas e equipamentos não especificados anteriormente; partes e peças
4671-1/00;Comércio atacadista de madeira e produtos derivados
4672-9/00;Comércio atacadista de ferragens e ferramentas
4673-7/00;Comércio atacadista de material elétrico
4674-5/00;Comércio atacadista de cimento
4679-6/01;Comércio atacadista de tintas, vernizes e similares
4679-6/02;Comércio atacadista de mármores e granitos
4679-6/03;Comércio atacadista de vidros, espelhos e vitrais
4679-6/04;Comércio atacadista especializado de materiais de construção não especificados anteriormente
4679-6/99;Comércio atacadista de materiais de construção em geral
4681-8/01;Comércio atacadista de álcool carburante, biodiesel, gasolina e demais derivados de petróleo, exceto lubrificantes, não realizado por transportador retalhista (TRR)
4681-8/02;Comércio atacadista de combustíveis realizado por transportador retalhista (TRR)
4681-8/03;Comércio atacadista de combustíveis de origem vegetal, exceto álcool carburante
4681-8/04;Comércio atacadista de combustíveis de origem mineral em bruto
4681-8/05;Comércio atacadista de lubrificantes
4682-6/00;Comércio atacadista de gás liqüefeito de petróleo (GLP)
4683-4/00;Comércio atacadista de defensivos agrícolas, adubos, fertilizantes e corretivos do solo
4684-2/01;Comércio atacadista de resinas e elastômeros
4684-2/02;Comércio atacadista de solventes
4684-2/99;Comércio atacadista de outros produtos químicos e petroquímicos não especificados anteriormente
4685-1/00;Comércio atacadista de produtos siderúrgicos e metalúrgicos, exceto para construção
4686-9/01;Comércio atacadista de papel e papelão em bruto
4686-9/02;Comércio atacadista de embalagens
4687-7/01;Comércio atacadista de resíduos de papel e papelão
4687-7/02;Comércio atacadista de resíduos e sucatas não-metálicos, exceto de papel e papelão
4687-7/03;Comércio atacadista de resíduos e sucatas metálicos
4689-3/01;Comércio atacadista de produtos da extração mineral, exceto combustíveis
4689-3/02;Comércio atacadista de fios e fibras têxteis beneficiados *
4689-3/99;Comércio atacadista especializado em outros produtos intermediários não especificados anteriormente
4691-5/00;Comércio atacadista de mercadorias em geral, com predominância de produtos alimentícios
4692-3/00;Comércio atacadista de mercadorias em geral, com predominância de insumos agropecuários
4693-1/00;Comércio atacadista de mercadorias em geral, sem predominância de alimentos ou de insumos agropecuários
4711-3/01;Comércio varejista de mercadorias em geral, com predominância de produtos alimentícios - hipermercados
4711-3/02;Comércio varejista de mercadorias em geral, com predominância de produtos alimentícios - supermercados
4712-1/00;Comércio varejista de mercadorias em geral, com predominância de produtos alimentícios - minimercados, mercearias e armazéns
4713-0/01;Lojas de departamentos ou magazines
4713-0/02;Lojas de variedades, exceto lojas de departamentos ou magazines
4713-0/03;Lojas duty free de aeroportos internacionais
4721-1/02;Padaria e confeitaria com predominância de revenda
4721-1/03;Comércio varejista de laticínios e frios
4721-1/04;Comércio varejista de doces, balas, bombons e semelhantes
4722-9/01;Comércio varejista de carnes - açougues
4722-9/02;Peixaria
4723-7/00;Comércio varejista de bebidas
4724-5/00;Comércio varejista de hortifrutigranjeiros
4729-6/01;Tabacaria
4729-6/02;Comércio varejista de mercadorias em lojas de conveniência
4729-6/99;Comércio varejista de produtos alimentícios em geral ou especializado em produtos alimentícios não especificados anteriormente
4731-8/00;Comércio varejista de combustíveis para veículos automotores
4732-6/00;Comércio varejista de lubrificantes
4741-5/00;Comércio varejista de tintas e materiais para pintura
4742-3/00;Comércio varejista de material elétrico
4743-1/00;Comércio varejista de vidros
4744-0/01;Comércio varejista de ferragens e ferramentas
4744-0/02;Comércio varejista de madeira e artefatos
4744-0/03;Comércio varejista de materiais hidráulicos
4744-0/04;Comércio varejista de cal, areia, pedra britada, tijolos e telhas
4744-0/05;Comércio varejista de materiais de construção não especificados anteriormente
4744-0/06;Comércio varejista de pedras para revestimento
4744-0/99;Comércio varejista de materiais de construção em geral
4751-2/01;Comércio varejista especializado de equipamentos e suprimentos de informática
4751-2/02;Recarga de cartuchos para equipamentos de informática
4752-1/00;Comércio varejista especializado de equipamentos de telefonia e comunicação
4753-9/00;Comércio varejista especializado de eletrodomésticos e equipamentos de áudio e vídeo
4754-7/01;Comércio varejista de móveis
4754-7/02;Comércio varejista de artigos de colchoaria
4754-7/03;Comércio varejista de artigos de iluminação
4755-5/01;Comércio varejista de tecidos
4755-5/02;Comercio varejista de artigos de armarinho
4755-5/03;Comercio varejista de artigos de cama, mesa e banho
4756-3/00;Comércio varejista especializado de instrumentos musicais e acessórios
4757-1/00;Comércio varejista especializado de peças e acessórios para aparelhos eletroeletrônicos para uso doméstico, exceto informática e comunicação
4759-8/01;Comércio varejista de artigos de tapeçaria, cortinas e persianas
4759-8/99;Comércio varejista de outros artigos de uso doméstico não especificados anteriormente
4761-0/01;Comércio varejista de livros
4761-0/02;Comércio varejista de jornais e revistas
4761-0/03;Comércio varejista de artigos de papelaria
4762-8/00;Comércio varejista de discos, CDs, DVDs e fitas
4763-6/01;Comércio varejista de brinquedos e artigos recreativos
4763-6/02;Comércio varejista de artigos esportivos
4763-6/03;Comércio varejista de bicicletas e triciclos; peças e acessórios
4763-6/04;Comércio varejista de artigos de caça, pesca e camping
4763-6/05;Comércio varejista de embarcações e outros veículos recreativos; peças e acessórios
4771-7/01;Comércio varejista de produtos farmacêuticos, sem manipulação de fórmulas
4771-7/02;Comércio varejista de produtos farmacêuticos, com manipulação de fórmulas
4771-7/03;Comércio varejista de produtos farmacêuticos homeopáticos
4771-7/04;Comércio varejista de medicamentos veterinários
4772-5/00;Comércio varejista de cosméticos, produtos de perfumaria e de higiene pessoal
4773-3/00;Comércio varejista de artigos médicos e ortopédicos
4774-1/00;Comércio varejista de artigos de óptica
4781-4/00;Comércio varejista de artigos do vestuário e acessórios
4782-2/01;Comércio varejista de calçados
4782-2/02;Comércio varejista de artigos de viagem
4783-1/01;Comércio varejista de artigos de joalheria
4783-1/02;Comércio varejista de artigos de relojoaria
4784-9/00;Comércio varejista de gás liqüefeito de petróleo (GLP)
4785-7/01;Comércio varejista de antigüidades
4785-7/99;Comércio varejista de outros artigos usados
4789-0/01;Comércio varejista de suvenires, bijuterias e artesanatos
4789-0/02;Comércio varejista de plantas e flores naturais
4789-0/03;Comércio varejista de objetos de arte
4789-0/04;Comércio varejista de animais vivos e de artigos e alimentos para animais de estimação
4789-0/05;Comércio varejista de produtos saneantes domissanitários
4789-0/06;Comércio varejista de fogos de artifício e artigos pirotécnicos
4789-0/07;Comércio varejista de equipamentos para escritório
4789-0/08;Comércio varejista de artigos fotográficos e para filmagem
4789-0/09;Comércio varejista de armas e munições
4789-0/99;Comércio varejista de outros produtos não especificados anteriormente
4911-6/00;Transporte ferroviário de carga
4912-4/01;Transporte ferroviário de passageiros intermunicipal e interestadual
4912-4/02;Transporte ferroviário de passageiros municipal e em região metropolitana
4912-4/03;Transporte metroviário
4921-3/01;Transporte rodoviário coletivo de passageiros, com itinerário fixo, municipal
4921-3/02;Transporte rodoviário coletivo de passageiros, com itinerário fixo, intermunicipal em região metropolitana
4922-1/01;Transporte rodoviário coletivo de passageiros, com itinerário fixo, intermunicipal, exceto em região metropolitana
4922-1/02;Transporte rodoviário coletivo de passageiros, com itinerário fixo, interestadual
4922-1/03;Transporte rodoviário coletivo de passageiros, com itinerário fixo, internacional
4923-0/01;Serviço de táxi
4923-0/02;Serviço de transporte de passageiros - locação de automóveis com motorista
4924-8/00;Transporte escolar
4929-9/01;Transporte rodoviário coletivo de passageiros, sob regime de fretamento, municipal
4929-9/02;Transporte rodoviário coletivo de passageiros, sob regime de fretamento, intermunicipal, interestadual e internacional
4929-9/03;Organização de excursões em veículos rodoviários próprios, municipal
4929-9/04;Organização de excursões em veículos rodoviários próprios, intermunicipal, interestadual e internacional
4929-9/99;Outros transportes rodoviários de passageiros não especificados anteriormente
4930-2/01;Transporte rodoviário de carga, exceto produtos perigosos e mudanças, municipal
4930-2/02;Transporte rodoviário de carga, exceto produtos perigosos e mudanças, intermunicipal, interestadual e internacional
4930-2/03;Transporte rodoviário de produtos perigosos
4930-2/04;Transporte rodoviário de mudanças
4940-0/00;Transporte dutoviário
4950-7/00;Trens turísticos, teleféricos e similares
5011-4/01;Transporte marítimo de cabotagem - Carga
5011-4/02;Transporte marítimo de cabotagem - passageiros
5012-2/01;Transporte marítimo de longo curso - Carga
5012-2/02;Transporte marítimo de longo curso - Passageiros
5021-1/01;Transporte por navegação interior de carga, municipal, exceto travessia
5021-1/02;Transporte por navegação interior de carga, intermunicipal, interestadual e internacional, exceto travessia
5022-0/01;Transporte por navegação interior de passageiros em linhas regulares, municipal, exceto travessia
5022-0/02;Transporte por navegação interior de passageiros em linhas regulares, intermunicipal, interestadual e internacional, exceto travessia
5030-1/01;Navegação de apoio marítimo
5030-1/02;Navegação de apoio portuário
5030-1/03;Serviços de rebocadores e empurradores
5091-2/01;Transporte por navegação de travessia, municipal
5091-2/02;Transporte por navegação de travessia intermunicipal, interestadual e internacional
5099-8/01;Transporte aquaviário para passeios turísticos
5099-8/99;Outros transportes aquaviários não especificados anteriormente
5111-1/00;Transporte aéreo de passageiros regular
5112-9/01;Serviço de táxi aéreo e locação de aeronaves com tripulação
5112-9/99;Outros serviços de transporte aéreo de passageiros não-regular
5120-0/00;Transporte aéreo de carga
5130-7/00;Transporte espacial
5211-7/01;Armazéns gerais - emissão de warrant
5211-7/02;Guarda-móveis
5211-7/99;Depósitos de mercadorias para terceiros, exceto armazéns gerais e guarda-móveis
5212-5/00;Carga e descarga
5221-4/00;Concessionárias de rodovias, pontes, túneis e serviços relacionados
5222-2/00;Terminais rodoviários e ferroviários
5223-1/00;Estacionamento de veículos
5229-0/01;Serviços de apoio ao transporte por táxi, inclusive centrais de chamada
5229-0/02;Serviços de reboque de veículos
5229-0/99;Outras atividades auxiliares dos transportes terrestres não especificadas anteriormente
5231-1/01;Administração da infra-estrutura portuária
5231-1/02;Atividades do Operador portuário
5232-0/00;Atividades de agenciamento marítimo
5239-7/01;Serviços de praticagem
5239-7/99;Atividades auxiliares dos transportes aquaviários não especificadas anteriormente
5240-1/01;Operação dos aeroportos e campos de aterrissagem
5240-1/99;Atividades auxiliares dos transportes aéreos, exceto operação dos aeroportos e campos de aterrissagem
5250-8/01;Comissaria de despachos
5250-8/02;Atividades de despachantes aduaneiros
5250-8/03;Agenciamento de cargas, exceto para o transporte marítimo
5250-8/04;Organização logística do transporte de carga
5250-8/05;Operador de transporte multimodal - OTM
5310-5/01;Atividades do Correio Nacional
5310-5/02;Atividades de franqueadas e permissionárias do Correio Nacional
5320-2/01;Serviços de malote não realizados pelo Correio Nacional
5320-2/02;Serviços de entrega rápida
5510-8/01;Hotéis
5510-8/02;Apart-hotéis
5510-8/03;Motéis
5590-6/01;Albergues, exceto assistenciais
5590-6/02;Campings
5590-6/03;Pensões
5590-6/99;Outros alojamentos não especificados anteriormente
5611-2/01;Restaurantes e similares
5611-2/02;Bares e outros estabelecimentos especializados em servir bebidas
5611-2/03;Lanchonetes, casas de chá, de sucos e similares
5612-1/00;Serviços ambulantes de alimentação
5620-1/01;Fornecimento de alimentos preparados preponderantemente para empresas
5620-1/02;Serviços de alimentação para eventos e recepções - bufê
5620-1/03;Cantinas - serviços de alimentação privativos
5620-1/04;Fornecimento de alimentos preparados preponderantemente para consumo domiciliar
5811-5/00;Edição de livros
5812-3/01;Edição de jornais diários
5812-3/02;Edição de jornais não diários
5813-1/00;Edição de revistas
5819-1/00;Edição de cadastros, listas e de outros produtos gráficos
5821-2/00;Edição integrada à impressão de livros
5822-1/01;Edição integrada a impressão de jornais diários
5822-1/02;Edição integrada a impressão de jornais não diários
5823-9/00;Edição integrada à impressão de revistas
5829-8/00;Edição integrada à impressão de cadastros, listas e de outros produtos gráficos
5911-1/01;Estúdios cinematográficos
5911-1/02;Produção de filmes para publicidade
5911-1/99;Atividades de produção cinematográfica, de vídeos e de programas de televisão não especificadasanteriormente
5912-0/01;Serviços de dublagem
5912-0/02;Serviços de mixagem sonora
5912-0/99;Atividades de pós-produção cinematográfica, de vídeos e de programas de televisão não especificadas anteriormente
5913-8/00;Distribuição cinematográfica, de vídeo e de programas de televisão
5914-6/00;Atividades de exibição cinematográfica
5920-1/00;Atividades de gravação de som e de edição de música
6010-1/00;Atividades de rádio e televisão
6021-7/00;Atividades de televisão aberta
6022-5/01;Programadoras
6022-5/02;Atividades relacionadas à televisão por assinatura, exceto programadoras
6110-8/01;Serviços de telefonia fixa comutada - STFC
6110-8/02;Serviços de redes de transportes de telecomunicações - SRTT
6110-8/03;Serviços de comunicação multimídia - SMC
6110-8/99;Serviços de telecomunicações por fio não especificados anteriormente
6120-5/01;Telefonia móvel celular
6120-5/02;Serviço móvel especializado - SME
6120-5/99;Serviços de telecomunicações sem fio não especificados anteriormente
6130-2/00;Telecomunicações por satélite
6141-8/00;Operadoras de televisão por assinatura por cabo
6142-6/00;Operadoras de televisão por assinatura por microondas
6143-4/00;Operadoras de televisão por assinatura por satélite
6190-6/01;Provedores de acesso às redes de comunicações
6190-6/02;Provedores de voz sobre protocolo internet - VOIP
6190-6/99;Outras atividades de telecomunicações não especificadas anteriormente
6201-5/01;Desenvolvimento de programas de computador sob encomenda
6201-5/02;Web design
6202-3/00;Desenvolvimento e licenciamento de programas de computador customizáveis
6203-1/00;Desenvolvimento e licenciamento de programas de computador não-customizáveis
6204-0/00;Consultoria em tecnologia da informação
6209-1/00;Suporte técnico, manutenção e outros serviços em tecnologia da informação
6311-9/00;Tratamento de dados, provedores de serviços de aplicação e serviços de hospedagem na internet
6319-4/00;Portais, provedores de conteúdo e outros serviços de informação na internet
6391-7/00;Agências de notícias
6399-2/00;Outras atividades de prestação de serviços de informação não especificadas anteriormente
6410-7/00;Banco Central
6421-2/00;Bancos comerciais
6422-1/00;Bancos múltiplos, com carteira comercial
6423-9/00;Caixas econômicas
6424-7/01;Bancos cooperativos
6424-7/02;Cooperativas centrais de crédito
6424-7/03;Cooperativas de crédito mútuo
6424-7/04;Cooperativas de crédito rural
6431-0/00;Bancos múltiplos, sem carteira comercial
6432-8/00;Bancos de investimento
6433-6/00;Bancos de desenvolvimento
6434-4/00;Agências de fomento
6435-2/01;Sociedades de crédito imobiliário
6435-2/02;Associações de poupança e empréstimo
6435-2/03;Companhias hipotecárias
6436-1/00;Sociedades de crédito, financiamento e investimento - financeiras
6437-9/00;Sociedades de crédito ao microempreendedor
6438-7/01;Bancos de câmbio
6438-7/02;Outra instituições de intermediação não-monetária não especificadas anteriormente
6440-9/00;Arrendamento mercantil
6450-6/00;Sociedades de capitalização
6461-1/00;Holdings de instituições financeiras
6462-0/00;Holdings de instituições não-financeiras
6463-8/00;Outras sociedades de participação, exceto holdings
6470-1/01;Fundos de investimento, exceto previdenciários e imobiliários
6470-1/02;Fundos de investimento previdenciários
6470-1/03;Fundos de investimento imobiliários
6491-3/00;Sociedades de fomento mercantil - factoring
6492-1/00;Securitização de créditos
6493-0/00;Administração de consórcios para aquisição de bens e direitos
6499-9/01;Clubes de investimento
6499-9/02;Sociedades de investimento
6499-9/03;Fundo garantidor de crédito
6499-9/04;Caixas de financiamento de corporações
6499-9/05;Concessão de crédito pelas OSCIP
6499-9/99;Outras atividades de serviços financeiros não especificadas anteriormente
6511-1/01;Sociedade seguradora de seguros vida
6511-1/02;Planos de auxílio-funeral
6512-0/00;Sociedade seguradora de seguros não vida
6520-1/00;Sociedade seguradora de seguros saúde
6530-8/00;Resseguros
6541-3/00;Previdência complementar fechada
6542-1/00;Previdência complementar aberta
6550-2/00;Planos de saúde
6611-8/01;Bolsa de valores
6611-8/02;Bolsa de mercadorias
6611-8/03;Bolsa de mercadorias e futuros
6611-8/04;Administração de mercados de balcão organizados
6612-6/01;Corretoras de títulos e valores mobiliários
6612-6/02;Distribuidoras de títulos e valores mobiliários
6612-6/03;Corretoras de câmbio
6612-6/04;Corretoras de contratos de mercadorias
6612-6/05;Agentes de investimentos em aplicações financeiras
6613-4/00;Administração de cartões de crédito
6619-3/01;Serviços de liquidação e custódia
6619-3/02;Correspondentes de instituições financeiras
6619-3/03;Representações de bancos estrangeiros
6619-3/04;Caixas eletrônicos
6619-3/05;Operadoras de cartões de débito
6619-3/99;Outras atividades auxiliares dos serviços financeiros não especificadas anteriormente
6621-5/01;Peritos e avaliadores de seguros
6621-5/02;Auditoria e consultoria atuarial
6622-3/00;Corretores e agentes de seguros, de planos de previdência complementar e de saúde
6629-1/00;Atividades auxiliares dos seguros, da previdência complementar e dos planos de saúde não especificadas anteriormente
6630-4/00;Atividades de administração de fundos por contrato ou comissão
6810-2/01;Compra e venda de imóveis próprios
6810-2/02;Aluguel de imóveis próprios
6810-2/03;Loteamento de imóveis próprios
6821-8/01;Corretagem na compra e venda e avaliação de imóveis
6821-8/02;Corretagem no aluguel de imóveis
6822-6/00;Gestão e administração da propriedade imobiliária*
6911-7/01;Serviços advocatícios
6911-7/02;Atividades auxiliares da justiça
6911-7/03;Agente de propriedade industrial
6912-5/00;Cartórios
6920-6/01;Atividades de contabilidade
6920-6/02;Atividades de consultoria e auditoria contábil e tributária
7020-4/00;Atividades de consultoria em gestão empresarial, exceto consultoria técnica específica
7111-1/00;Serviços de arquitetura
7112-0/00;Serviços de engenharia
7119-7/01;Serviços de cartografia, topografia e geodésia
7119-7/02;Atividades de estudos geológicos
7119-7/03;Serviços de desenho técnico relacionados à arquitetura e engenharia
7119-7/04;Serviços de perícia técnica relacionados à segurança do trabalho
7119-7/99;Atividades técnicas relacionadas à engenharia e arquitetura não especificadas anteriormente
7120-1/00;Testes e análises técnicas
7210-0/00;Pesquisa e desenvolvimento experimental em ciências físicas e naturais
7220-7/00;Pesquisa e desenvolvimento experimental em ciências sociais e humanas
7311-4/00;Agências de publicidade
7312-2/00;Agenciamento de espaços para publicidade, exceto em veículos de comunicação
7319-0/01;Criação e montagem de estandes para feiras e exposições
7319-0/02;Promoção de vendas
7319-0/03;Marketing direto
7319-0/04;Consultoria em publicidade
7319-0/99;Outras atividades de publicidade não especificadas anteriormente
7320-3/00;Pesquisas de mercado e de opinião pública
7410-2/03;Design de produto
7410-2/99;Atividades de design não especificadas anteriormente
7410-2/02;Design de interiores
7420-0/01;Atividades de produção de fotografias, exceto aérea e submarina
7420-0/02;Atividades de produção de fotografias aéreas e submarinas
7420-0/03;Laboratórios fotográficos
7420-0/04;Filmagem de festas e eventos
7420-0/05;Serviços de microfilmagem
7490-1/01;Serviços de tradução, interpretação e similares
7490-1/02;Escafandria e mergulho
7490-1/03;Serviços de agronomia e de consultoria às atividades agrícolas e pecuárias
7490-1/04;Atividades de intermediação e agenciamento de serviços e negócios em geral, exceto imobiliários
7490-1/05;Agenciamento de profissionais para atividades esportivas, culturais e artísticas
7490-1/99;Outras atividades profissionais, científicas e técnicas não especificadas anteriormente
7500-1/00;Atividades veterinárias
7711-0/00;Locação de automóveis sem condutor
7719-5/01;Locação de embarcações sem tripulação, exceto para fins recreativos
7719-5/02;Locação de aeronaves sem tripulação
7719-5/99;Locação de outros meios de transporte não especificados anteriormente, sem condutor
7721-7/00;Aluguel de equipamentos recreativos e esportivos
7722-5/00;Aluguel de fitas de vídeo, DVDs e similares
7723-3/00;Aluguel de objetos do vestuário, jóias e acessórios
7729-2/01;Aluguel de aparelhos de jogos eletrônicos
7729-2/02;Aluguel de móveis, utensílios e aparelhos de uso doméstico e pessoal; instrumentos musicais
7729-2/03;Aluguel de material médico*
7729-2/99;Aluguel de outros objetos pessoais e domésticos não especificados anteriormente
7731-4/00;Aluguel de máquinas e equipamentos agrícolas sem operador
7732-2/01;Aluguel de máquinas e equipamentos para construção sem operador, exceto andaimes
7732-2/02;Aluguel de andaimes
7733-1/00;Aluguel de máquinas e equipamentos para escritórios
7739-0/01;Aluguel de máquinas e equipamentos para extração de minérios e petróleo, sem operador
7739-0/02;Aluguel de equipamentos científicos, médicos e hospitalares, sem operador
7739-0/03;Aluguel de palcos, coberturas e outras estruturas de uso temporário, exceto andaimes
7739-0/99;Aluguel de outras máquinas e equipamentos comerciais e industriais não especificados anteriormente, sem operador
7740-3/00;Gestão de ativos intangíveis não-financeiros
7810-8/00;Seleção e agenciamento de mão-de-obra
7820-5/00;Locação de mão-de-obra temporária
7830-2/00;Fornecimento e gestão de recursos humanos para terceiros
7911-2/00;Agências de viagens
7912-1/00;Operadores turísticos
7990-2/00;Serviços de reservas e outros serviços de turismo não especificados anteriormente
8011-1/01;Atividades de vigilância e segurança privada
8011-1/02;Serviços de adestramento de cães de guarda
8012-9/00;Atividades de transporte de valores
8020-0/01;Atividades de monitoramento de sistemas de segurança eletrônico
